{
  "schemaVersion": "1.0.0",
  "manifestId": "issues:packet:107:7-7:revision:1:packet:107:7-7:source:source-reviewer-1",
  "packetId": "packet:107:7-7",
  "draftId": "draft:packet:107:7-7:revision:1",
  "revision": 1,
  "scope": {
    "type": "packet",
    "ayahIds": [
      "ayah:107:7"
    ]
  },
  "status": "resolved",
  "issues": []
}
