{
  "schemaVersion": "1.0.0",
  "manifestId": "issues:packet:107:3-4:revision:1:packet:107:3-4:grammar:grammar-reviewer-1",
  "packetId": "packet:107:3-4",
  "draftId": "draft:packet:107:3-4:revision:1",
  "revision": 1,
  "scope": {
    "type": "packet",
    "ayahIds": ["ayah:107:3", "ayah:107:4"]
  },
  "status": "resolved",
  "issues": []
}
