{
  "schemaVersion": "1.0.0",
  "manifestId": "issues:packet:107:5-6:revision:1:packet:107:5-6:morphology:morphology-reviewer-1",
  "packetId": "packet:107:5-6",
  "draftId": "draft:107:5-6:revision-001",
  "revision": 1,
  "scope": {
    "type": "packet",
    "ayahIds": ["ayah:107:5", "ayah:107:6"]
  },
  "status": "resolved",
  "issues": []
}
